{
  "$schema": "https://json-schema.org/draft/2020-12/schema",
  "$id": "https://gemelo.invalid/contratos/hornero-manifiesto.schema.json",
  "$comment": "Manifiesto por finca del hornero de olivos (ADR-0018, contratos/olivo-horneado.md §3): /teselas/<finca>/olivos/manifiesto.json. JSON Schema 2020-12 estándar; lo valida ajv en pruebas/guardianes/horneado.test.js. Lo que el esquema no dice (cada huella existe como objeto, la época actual está entre las horneadas, las filas no se repiten, los bytes coinciden con el objeto) lo comprueba el hornero (O7c) y el guardián.",
  "title": "hornero-manifiesto",
  "type": "object",
  "required": ["v", "finca", "formato", "gen_version", "cache_version", "horneado_en", "brotli", "actual", "epocas", "variantes", "propios"],
  "additionalProperties": false,
  "properties": {
    "v": { "const": 1, "$comment": "versión del contrato del manifiesto" },
    "finca": { "type": "string", "pattern": "^[a-z0-9_]+$", "$comment": "el finca_id del índice" },
    "formato": { "const": 1, "$comment": "versión de formato de las recetas horneadas (la del byte 4 de cada objeto); si el cliente no la entiende, calcula" },
    "gen_version": { "type": "string", "minLength": 1, "$comment": "GEN_VERSION con que se calcularon; si no es la del motor, el cliente ignora el manifiesto entero" },
    "cache_version": { "type": "integer", "minimum": 1, "$comment": "CACHE_VERSION con que se calcularon; misma regla" },
    "horneado_en": { "type": "string", "pattern": "^[0-9]{4}-[0-9]{2}-[0-9]{2}T[0-9:.]+Z$", "$comment": "ISO 8601 en UTC («2026-10-29T12:00:00Z»): cuándo terminó el hornero; el manifiesto se escribe el último" },
    "brotli": { "type": "integer", "minimum": 0, "maximum": 11, "$comment": "calidad con que se comprimieron los .br (9 de diario, 11 en release)" },
    "actual": { "$ref": "#/$defs/epoca", "$comment": "la época que valía al hornear; está entre las de `epocas`" },
    "epocas": {
      "type": "array", "minItems": 1, "maxItems": 7,
      "items": {
        "type": "object", "required": ["epoca", "desde", "hasta"], "additionalProperties": false,
        "properties": { "epoca": { "$ref": "#/$defs/epoca" }, "desde": { "$ref": "#/$defs/fecha" }, "hasta": { "$ref": "#/$defs/fecha" } }
      },
      "$comment": "las épocas horneadas (la actual y la siguiente) con su ventana de fechas, copiada de contratos/epocas-calendario.json (decisión 64)"
    },
    "variantes": {
      "type": "array",
      "items": {
        "type": "object", "required": ["tipo", "semilla", "nivel", "epoca", "huella", "bytes", "bytes_br"], "additionalProperties": false,
        "properties": {
          "tipo": { "enum": ["planton", "adulto1", "adulto2", "adulto3", "centenario", "centenario2", "centenario3"], "$comment": "clave de TIPOS (contratos/olivo-generado.md §1); las variantes no llevan parámetros" },
          "semilla": { "type": "integer", "minimum": 0, "maximum": 4294967295 },
          "nivel": { "enum": ["E0", "E1", "E2", "E2VR"], "$comment": "hoy solo E2 y E2VR (ADR-0018)" },
          "epoca": { "$ref": "#/$defs/epoca" },
          "huella": { "$ref": "#/$defs/huella" },
          "bytes": { "type": "integer", "minimum": 1, "$comment": "tamaño del objeto SIN comprimir (lo que se hashea)" },
          "bytes_br": { "type": "integer", "minimum": 1, "$comment": "tamaño del <huella>.br en disco (lo que viaja)" }
        }
      }
    },
    "propios": {
      "type": "object", "required": ["activos"], "additionalProperties": false,
      "properties": {
        "activos": { "type": "boolean", "$comment": "bandera por finca; apagada por defecto. Encendida, hay un manifiesto binario por tesela" },
        "combinaciones": {
          "type": "array", "minItems": 1,
          "items": { "type": "object", "required": ["nivel", "epoca"], "additionalProperties": false, "properties": { "nivel": { "enum": ["E0", "E1"] }, "epoca": { "$ref": "#/$defs/epoca" } } },
          "$comment": "el orden de las huellas de cada olivo en el manifiesto de tesela: la huella j es la de combinaciones[j]"
        },
        "manifiesto_tesela": { "type": "string", "pattern": "^[^{}]*\\{kx\\}[^{}]*\\{ky\\}[^{}]*$", "$comment": "ruta relativa a la carpeta olivos/ con {kx} y {ky}, p. ej. t/{kx}_{ky}.olivos (binario de contratos/olivo-horneado.md §5)" }
      },
      "if": { "properties": { "activos": { "const": true } } },
      "then": { "required": ["combinaciones", "manifiesto_tesela"] }
    }
  },
  "$defs": {
    "epoca": { "enum": ["reposo", "boton", "flor", "cuajado", "verde", "envero", "madura"] },
    "fecha": { "type": "string", "pattern": "^(0[1-9]|1[0-2])-(0[1-9]|[12][0-9]|3[01])$" },
    "huella": { "type": "string", "pattern": "^[0-9a-f]{32}$", "$comment": "SHA-256 truncado a 128 bits de los bytes sin comprimir, en hexadecimal; el objeto se llama <huella>.br" }
  }
}
